{
  "contract_name": "node-self-image-set.v1",
  "contract_version": 1,
  "set_id": "self-image-set-fixture-20260716",
  "snapshot_id": "snapshot-fixture-20260716",
  "snapshot_digest": "sha256:aaaaaaaaaaaaaaaaaaaaaaaaaaaaaaaaaaaaaaaaaaaaaaaaaaaaaaaaaaaaaaaa",
  "registry_reference": "#/registry_projection",
  "registry_projection": [
    {
      "uid": "ent_repo_01ARZ3NDEKTSV4RRFFQ69G5FAV",
      "entity_type": "repo",
      "lifecycle_status": "active"
    }
  ],
  "registry_digest": "sha256:03d6d20167b30e10de09b2ae256b6a504d8b0884076048fcfaab97e257cd7d22",
  "registered_node_ids": [
    "ent_repo_01ARZ3NDEKTSV4RRFFQ69G5FAV"
  ],
  "self_images": [
    {
      "contract_name": "node-self-image.v1",
      "contract_version": 1,
      "node_id": "ent_repo_01ARZ3NDEKTSV4RRFFQ69G5FAV",
      "node_type": "repository",
      "display_name": "${NODE_DISPLAY_NAME}",
      "owner_reference": "owner_governance_registry",
      "relations": {
        "incoming": [],
        "outgoing": [
          {
            "relation_type": "produces",
            "target_node_id": "ent_module_01ARZ3NDEKTSV4RRFFQ69G5FAW",
            "evidence_references": ["event:relation-fixture-001"]
          }
        ]
      },
      "cursors": {
        "memory": "memory:000042",
        "event": "event:000117"
      },
      "digests": {
        "constitutional": "sha256:2222222222222222222222222222222222222222222222222222222222222222",
        "topology": "sha256:3333333333333333333333333333333333333333333333333333333333333333"
      },
      "observations": [
        {
          "key": "implementation_state",
          "value": "verified",
          "observed_at": "2026-07-16T18:20:00Z",
          "evidence_references": ["receipt:node-verifier-fixture"]
        }
      ],
      "active_ideal_forms": [
        {
          "form_id": "ideal-form:governed-memory-fixture",
          "implementation_state": "verified",
          "distance_to_ideal": 0,
          "predicate_references": ["predicate-fixture-schema"],
          "evidence_references": ["receipt:node-verifier-fixture"]
        }
      ],
      "reconciled_at": "2026-07-16T18:21:00Z",
      "evidence_references": ["receipt:node-verifier-fixture"]
    }
  ],
  "counts": {
    "registered": 1,
    "exported": 1
  },
  "readiness": {
    "exact_all": true,
    "unresolved_blockers": [],
    "quarantines": [],
    "missing_requirements": [],
    "citation_debt": [],
    "incomplete_predicates": [],
    "ready": true,
    "status": "ready"
  },
  "digest_algorithm": "sha256-rfc8785-excluding-self-digest-v1",
  "set_digest": "sha256:8888888888888888888888888888888888888888888888888888888888888888"
}
